sentence_id,language_code,language_name,text
527,jpn_Jpan,Japanese,出掛けました
528,eng_Latn,English,Tonight you will make your debut in Verdi's Macbeth.
528,jpn_Jpan,Japanese,今晩君は マクベスでデビューだ
529,eng_Latn,English,He is the greatest architect that has ever lived.
529,jpn_Jpan,Japanese,彼は古今まれなりっぱな建築家である。
530,eng_Latn,English,13 stitches.
530,jpn_Jpan,Japanese,13針
531,eng_Latn,English,"Claire, this is Simon."
531,jpn_Jpan,Japanese,クレア　サイモンだ
532,eng_Latn,English,Shoot already or we'll lose it!
532,jpn_Jpan,Japanese,撃つのよ！ 逃げちゃうじゃない！
533,eng_Latn,English,The whole family. [giggles]
533,jpn_Jpan,Japanese,家族全員で
534,eng_Latn,English,"Brilliant move, Skipper."
534,jpn_Jpan,Japanese,妙案です　スキッパー
535,eng_Latn,English,I am the Guardian! Me.
535,jpn_Jpan,Japanese,私がガーディアンだ！
536,eng_Latn,English,- Inlet pipe needs replacing.
536,jpn_Jpan,Japanese,- パイプを交換しないと
537,eng_Latn,English,"♪ But if you wanna leave, take good care ♪"
537,jpn_Jpan,Japanese,"♪ But if you wanna leave, take good care ♪"
538,eng_Latn,English,All right. Starting now. You can't blink.
538,jpn_Jpan,Japanese,今からまばたきしちゃダメだから
539,eng_Latn,English,You won't do another lap?
539,jpn_Jpan,Japanese,あと１回ぐらい行っとく？
540,eng_Latn,English,"For us, English was the language to fall back on when we couldn't make ourselves understood in French."
540,jpn_Jpan,Japanese,フランス語が通じなかった場合に、私たちが最後に頼りにする言語は英語だった。
541,eng_Latn,English,- And then he follows this guy to the washroom...
541,jpn_Jpan,Japanese,- クリスティーナ... それから...
542,eng_Latn,English,"Hey. No. We're not going to hurt you unless you try something stupid first, all right?"
542,jpn_Jpan,Japanese,何もしないさ 君が何もしなければ
543,eng_Latn,English,Hatter ...
543,jpn_Jpan,Japanese,ハッター...
544,eng_Latn,English,That's Della Togashi's nickname.
544,jpn_Jpan,Japanese,あ... あれは ニックネームです
545,eng_Latn,English,CHILTON!
545,jpn_Jpan,Japanese,チルトン!
546,eng_Latn,English,I didn't you to see me die.
546,jpn_Jpan,Japanese,私が死ぬ姿を見せたくなくて
547,eng_Latn,English,I wonder if he/she could sell these squares.
547,jpn_Jpan,Japanese,これ売れないかな？
548,eng_Latn,English,Trask might be planning to kill somebody.
548,jpn_Jpan,Japanese,トラスク氏は誰かを殺そうと 企んでいるに違いありません
549,eng_Latn,English,"Oh, do be serious. You'll be bored silly by the end of the week."
549,jpn_Jpan,Japanese,よく考えたほうがいいわ あなたは　週末までには　すっごく退屈してるわよ
550,eng_Latn,English,The Dreyfus Act must be repealed.
550,jpn_Jpan,Japanese,ドレフュス法は 撤廃されなければならない
551,eng_Latn,English,"Hey, just wait a bit."
551,jpn_Jpan,Japanese,キスしないの？
552,eng_Latn,English,It's all right.
552,jpn_Jpan,Japanese,大丈夫
553,eng_Latn,English,1945?
553,jpn_Jpan,Japanese,１９４５年？
554,eng_Latn,English,Waiting for the next lottery result.
554,jpn_Jpan,Japanese,宝くじの当選結果を待ってる
555,eng_Latn,English,"- With relish, yeah."
555,jpn_Jpan,Japanese,- 興味があったからよ - そうか
556,eng_Latn,English,- Would you kindly tell me your name?
556,jpn_Jpan,Japanese,- 宜しければ　お名前を？
557,eng_Latn,English,Bring in your troopers on my signal!
557,jpn_Jpan,Japanese,俺のサインで軍隊を連れて
558,eng_Latn,English,"Rick says we're not running, we're not running."
558,jpn_Jpan,Japanese,リック言ってくれ ここを出て行かないって
559,eng_Latn,English,"Yeah, then I'd even forget my anger."
559,jpn_Jpan,Japanese,そこまで怒らなかったですね 僕たちも
560,eng_Latn,English,"♪ Yes, peace train, holy roller ♪"
560,jpn_Jpan,Japanese,"♪ Yes, peace train, holy roller ♪"
561,eng_Latn,English,That's unfortunate. (cell phone rings)
561,jpn_Jpan,Japanese,不運だったな
562,eng_Latn,English,"What did you mean by ""nothing"", Dad? What's nothing?"
562,jpn_Jpan,Japanese,"""ない"" って言ったでしょ？"
563,eng_Latn,English,Just a lowly candy striper.
563,jpn_Jpan,Japanese,看護助手よ
564,eng_Latn,English,I paid for that. I paid for that.
564,jpn_Jpan,Japanese,罪は償った...
565,eng_Latn,English,Besides... I wanna see your next drama.
565,jpn_Jpan,Japanese,〈あなたの新作を 見たいしね〉
566,eng_Latn,English,So what'd you do with Roland's body?
566,jpn_Jpan,Japanese,ロランドの死体は？
567,eng_Latn,English,Expand All Threads
567,jpn_Jpan,Japanese,すべてのスレッドを展開(P)
568,eng_Latn,English,I never fail to write to my mother once a month.
568,jpn_Jpan,Japanese,私は月に一度必ず母に手紙を書く。
569,eng_Latn,English,I'll see her safely home.
569,jpn_Jpan,Japanese,雨宮は　俺が送ってくから
570,eng_Latn,English,Viktor's death-- is it payback for killing that detective?
570,jpn_Jpan,Japanese,ビクターの死は 報復か？
571,eng_Latn,English,We've been told. - Yeah.
571,jpn_Jpan,Japanese,既に知っている
572,eng_Latn,English,Turn-On Tricks How to Make Him Hot.
572,jpn_Jpan,Japanese,"""彼をあなたに釘付けにするコツ"""
573,eng_Latn,English,You are beautiful I am young
573,jpn_Jpan,Japanese,♪君は気づくだろう 俺はまだ若い
574,eng_Latn,English,And the bruises on the coroner aren't just on his face.
574,jpn_Jpan,Japanese,そして検死官のあざ... 顔には無いけどー
575,eng_Latn,English,"As a reformed professional counterfeiter, what is the Dutchman's interest in these?"
575,jpn_Jpan,Japanese,更生したプロの偽造屋として聞く ダッチマンは　これのどこに興味を持ったんだ？
576,eng_Latn,English,He's manipulating you. - He knows something about what's going on on this island.
576,jpn_Jpan,Japanese,島で何が起きているのか 知っている
577,eng_Latn,English,"If he shows up tomorrow night, he doesn't get near my chipmunks. -Got it?"
577,jpn_Jpan,Japanese,奴が現れたら 絶対に近づけるな
578,eng_Latn,English,"You don't really think this is about Maryam Hasan, do you?"
578,jpn_Jpan,Japanese,- スイッチ? 相手が本当に マリアム・ハサンと思ってるの?
579,eng_Latn,English,Error
579,jpn_Jpan,Japanese,エラー
580,eng_Latn,English,"I asked, what's a data stack?"
580,jpn_Jpan,Japanese,データスタックって何なの？
581,eng_Latn,English,I don't know.
581,jpn_Jpan,Japanese,分からない
582,eng_Latn,English,"""Nicht schiessen!"" ""Get behind me now."
582,jpn_Jpan,Japanese,- 撃つな - 終わった　終りだ
583,eng_Latn,English,"- Hey, we're trying to help you. Okay?"
583,jpn_Jpan,Japanese,- ちょっと 待ってて いい ?
584,eng_Latn,English,- What do you do with it?
584,jpn_Jpan,Japanese,- 目的は？
585,eng_Latn,English,Coulson needs help with the emergency transceiver.
585,jpn_Jpan,Japanese,緊急無線の件でクールソンが手助けを求めてるわ。
586,eng_Latn,English,One more medium portion!
586,jpn_Jpan,Japanese,並 おかわり ！
587,eng_Latn,English,How do you feel since you killed Wallace Rourke?
587,jpn_Jpan,Japanese,ウォレス・ロークを殺してから どんな気分かな？
588,eng_Latn,English,"Beautiful ones. Wasn't all bad, you know."
588,jpn_Jpan,Japanese,いい事も、そうでもない事も
589,eng_Latn,English,- What?
589,jpn_Jpan,Japanese,- は？
590,eng_Latn,English,"""R.L. Stine"" What ever happened to that guy?"
590,jpn_Jpan,Japanese,"""R・L・スタイン""に 何があったんだ？"
591,eng_Latn,English,"Sure, Mr. DeCarlo."
591,jpn_Jpan,Japanese,そう信じてますけど...
592,eng_Latn,English,I-I live close. I'll just go grab them.
592,jpn_Jpan,Japanese,近くに住んでるから 取って来るわ
593,eng_Latn,English,"Yeah, well, you're obviously not because you're being passive-aggressive."
593,jpn_Jpan,Japanese,そうかな 今日は控え目に喚いてる
594,eng_Latn,English,I shot Skye because that's what the Clairvoyant told me to do.
594,jpn_Jpan,Japanese,いいや それが理由じゃない 透視能力者から言われたからだ
595,eng_Latn,English,"I can only guess she's dead by now,"
595,jpn_Jpan,Japanese,彼女はもう死んだのか？
596,eng_Latn,English,Get me a pilot. - Yes sir.
596,jpn_Jpan,Japanese,飛行機を用意しろ
597,eng_Latn,English,"""All that maddens and torments, Wake up."""
597,jpn_Jpan,Japanese,"- ""すべての激怒と苦悩のほとんどが..."""
598,eng_Latn,English,Could love someone like me
598,jpn_Jpan,Japanese,この俺にホレてんだ
599,eng_Latn,English,"Okay, we'll take some pictures, explore a bit, and then we'll be on our way."
599,jpn_Jpan,Japanese,写真撮って探索するだけ
600,eng_Latn,English,We should pick out a couple folks to kill?
600,jpn_Jpan,Japanese,私たちは選ぶべきです カップルの人々を殺すために？
601,eng_Latn,English,He sank the deal without batting an eyelash.
601,jpn_Jpan,Japanese,彼は平然と取引をつぶしました。
602,eng_Latn,English,They moved ahead slowly.
602,jpn_Jpan,Japanese,彼らはゆっくり前進した。
603,eng_Latn,English,"You will all make this bunkroom, your home. You will keep your home clean."
603,jpn_Jpan,Japanese,全員でここをお前らの家として 常に清潔にしなければならない
604,eng_Latn,English,Pour la pièce de résistance.
604,jpn_Jpan,Japanese,これで出来上がり・・・
605,eng_Latn,English,Wait. Before you go. I'm working on something new.
605,jpn_Jpan,Japanese,帰る前に　僕の新ネタを
606,eng_Latn,English,What did Dad tell you?
606,jpn_Jpan,Japanese,パパが何か言ったの?
607,eng_Latn,English,♪ to someone else's touch ♪
607,jpn_Jpan,Japanese,♪ to someone else's touch ♪
608,eng_Latn,English,That puts the fights with my father in perspective.
608,jpn_Jpan,Japanese,彼女は報復を望んでる
609,eng_Latn,English,And we just the help y'all hire to drill a hole.
609,jpn_Jpan,Japanese,俺達は穴掘りに雇われた
610,eng_Latn,English,WHY ON EARTH WOULD YOU DO THAT? -SORRY.
610,jpn_Jpan,Japanese,一体全体 どうしたんだ？
611,eng_Latn,English,She's a genius at mind jobs.
611,jpn_Jpan,Japanese,心理学が得意なのに
612,eng_Latn,English,Demonstration for Gibbs. You know how hard it is to explain technical stuff to him.
612,jpn_Jpan,Japanese,ボスに技術的な説明は 無意味だからね
613,eng_Latn,English,We will not be seeing our Hobbit again. He is long gone.
613,jpn_Jpan,Japanese,もはや あのホビットと 会う事はない 国に帰った
614,eng_Latn,English,"Rosa, are you picking up on this?"
614,jpn_Jpan,Japanese,ロサ　これは 拾ってるか？
615,eng_Latn,English,"Let's go. Let's go, let's go."
615,jpn_Jpan,Japanese,行こう　行こう
616,eng_Latn,English,"When I hear this song, I think of you, and miss you."
616,jpn_Jpan,Japanese,この歌を聞いたら、あなたについて思って、懐かしむんだ。
617,eng_Latn,English,Hello?
617,jpn_Jpan,Japanese,ねえ
618,eng_Latn,English,"Shit, Virgil."
618,jpn_Jpan,Japanese,マズイだろう
619,eng_Latn,English,She is a contract... with me.
619,jpn_Jpan,Japanese,私との契約だ
620,eng_Latn,English,I'm sorry. You'll need to speak to my banker about that.
620,jpn_Jpan,Japanese,私のパトロンと話して下さい
621,eng_Latn,English,This is a report prepared for your stepmother by a private investigator she'd hired to look into your father.
621,jpn_Jpan,Japanese,これは　あなたの義理の母が あなたの父親を調べるために雇った 私立探偵が作成した報告書よ
622,eng_Latn,English,- Tell him we're climbing.
622,jpn_Jpan,Japanese,- 上昇中と言え
623,eng_Latn,English,This clock seems to be broken.
623,jpn_Jpan,Japanese,時計がどこか故障しているらしい。
624,eng_Latn,English,"Lillian, I have never broken my word to you, but I'm sorry, it is dead."
624,jpn_Jpan,Japanese,"""私は約束を破った事がない だが済まない、無理だ"""
625,eng_Latn,English,Is that why you decided to take the floor?
625,jpn_Jpan,Japanese,だから　話をしようと？
626,eng_Latn,English,I've been stuck here since the blackout.
626,jpn_Jpan,Japanese,ブラックアウト以来 足止めされていたけど
627,eng_Latn,English,Or you go down.
627,jpn_Jpan,Japanese,人生おしまいだぞ
628,eng_Latn,English,You take me to the ship.
628,jpn_Jpan,Japanese,宇宙船に連れて行ってくれ
629,eng_Latn,English,And here I'll stay
629,jpn_Jpan,Japanese,♪ 涙は
630,eng_Latn,English,It's probably better if I didn't mention names.
630,jpn_Jpan,Japanese,言わないほうがいいでしょう
631,eng_Latn,English,"But be careful, he's in a temper."
631,jpn_Jpan,Japanese,気をつけて 気分がすぐれないので
632,eng_Latn,English,Get rid of that crap or I'll notify the Mayor!
632,jpn_Jpan,Japanese,本部に報告してくる
633,eng_Latn,English,"If we charge someone without sufficient evidence to hold them, they may disappear for good, so you've got two days to make sure you find something solid."
633,jpn_Jpan,Japanese,十分な証拠もなしに 検挙すれば 永久に消える その２日間を 容疑の地固めに費やせ
634,eng_Latn,English,"Look at your wife, Jesse. Look at her face."
634,jpn_Jpan,Japanese,奥さんを見ろ、ジェシー 彼女の顔を
635,eng_Latn,English,Okay. You too.
635,jpn_Jpan,Japanese,ええ　パパも
636,eng_Latn,English,"You know, you don't have to stick around."
636,jpn_Jpan,Japanese,僕について回ってる必要は　無いよ
637,eng_Latn,English,Just need to put some pants on.
637,jpn_Jpan,Japanese,パンツ履かなきゃ
638,eng_Latn,English,"Unless of course, you also thought that garlic and silver crosses would hurt them."
638,jpn_Jpan,Japanese,ニンニクと十字架で 倒せると思ってるならね
639,eng_Latn,English,No one... gets out and comes back without repercussions.
639,jpn_Jpan,Japanese,誰でも... 引退した人間が戻ってきたなら 何かしらの影響は避けられない
640,eng_Latn,English,"And finally, the immobile Arman..."
640,jpn_Jpan,Japanese,（山里）そう ついに あの 全く動かなかった男アーマンが
641,eng_Latn,English,"WE'VE BEEN LOCKING ON TO YOUR RADIO SIGNAL. NOW, YOU CAN GET A BEARING FROM THE RADIO SIGNAL, YES?"
641,jpn_Jpan,Japanese,無線信号から 調べてる
642,eng_Latn,English,It was... It was supposed to be me.
642,jpn_Jpan,Japanese,でもその夜は仕事が長引いて
643,eng_Latn,English,She's from a village near where I grew up.
643,jpn_Jpan,Japanese,彼女は私が生まれたところの近くの村の出身だ
644,eng_Latn,English,I took a taxi so as to catch the train.
644,jpn_Jpan,Japanese,私はその列車に間に合うようにタクシーに乗った。
645,eng_Latn,English,"Well, I don't have that kind of imagination. I barely picture odd numbered things."
645,jpn_Jpan,Japanese,そういうのは苦手だ 変な回数を想像しちゃう
646,eng_Latn,English,Generate 1394 Bus Reset
646,jpn_Jpan,Japanese,1394 バスリセットを生成
647,eng_Latn,English,We can go tomorrow if you want to.
647,jpn_Jpan,Japanese,- あした 乗りたい
648,eng_Latn,English,I have to finalize a few things before we go.
648,jpn_Jpan,Japanese,行く前に、いくつかのことを言っておきたい。
649,eng_Latn,English,What the fuck? He was right here!
649,jpn_Jpan,Japanese,さっき居たのに！
650,eng_Latn,English,Thomas Gabriel's the guy who shut down NORAD with a laptop just to prove a point.
650,jpn_Jpan,Japanese,彼ははラップトップPCで 防衛システムを停めてみせた．． 主張を証明するため。
651,eng_Latn,English,But I think it'll get here soon.
651,jpn_Jpan,Japanese,ああ... もう来ると思います
652,eng_Latn,English,how many pillows is that?
652,jpn_Jpan,Japanese,マクラ何個あるの？
653,eng_Latn,English,No need. I just caught up in the elevator.
653,jpn_Jpan,Japanese,必要ない　エレベーターの中で聞いた
654,eng_Latn,English,"And if I don't, then what?"
654,jpn_Jpan,Japanese,俺がそうしないならどうする?
655,eng_Latn,English,# Watch out!
655,jpn_Jpan,Japanese,♪ Watch out!
656,eng_Latn,English,The Kentucky guy is desperate. Don't worry about it.
656,jpn_Jpan,Japanese,ケンタッキーの奴らは必死なんだ 心配ない
657,eng_Latn,English,Open the back of the truck.
657,jpn_Jpan,Japanese,車の後ろを開けて
658,eng_Latn,English,"The Americans, they're murderers, okay?"
658,jpn_Jpan,Japanese,アメリカ人どもめ、 ヤツらは殺人者だ、これでいい？
659,eng_Latn,English,"Corbett, I swear, I haven't spoken a word."
659,jpn_Jpan,Japanese,いいえ 何も言ってないわ
660,eng_Latn,English,Sherlock... we're being followed. I knew we couldn't outrun the police.
660,jpn_Jpan,Japanese,警官があそこに
661,eng_Latn,English,Pete Harris and me did a deuce together at Joliet.
661,jpn_Jpan,Japanese,ハリスと俺は イリノイのムショで同室だった
662,eng_Latn,English,I wanted to apologise. Not to her - to you.
662,jpn_Jpan,Japanese,謝りたいわ　彼女にじゃなく あなたにね
663,eng_Latn,English,It's quaint.
663,jpn_Jpan,Japanese,it's quaint 古風で趣のある
664,eng_Latn,English,The police quickly got on the track of the murderer.
664,jpn_Jpan,Japanese,警察はまもなく殺人犯の手がかりをつかんだ。
665,eng_Latn,English,He's recruiting an army of supervillains and making homemade bombs.
665,jpn_Jpan,Japanese,彼は超悪玉の軍隊を募集 自家製爆弾を製造してる
666,eng_Latn,English,It's dad! Yeah.
666,jpn_Jpan,Japanese,パパだ！
667,eng_Latn,English,"Normally when you go on a date with a girl, you'd take her to the theater to watch a movie, but when you're— when you're truly comfortable with someone, you stay at home and watch Netflix. Like, you and Jessie would probably stay at home together all the time, watching movies."
667,jpn_Jpan,Japanese,だけど本当に親密になりたいときは 家でネットフリックスを見るんだよ あんたとジェシーはいつも一緒に ずっと家に居て
668,eng_Latn,English,I... can't say I'm... totally surprised.
668,jpn_Jpan,Japanese,すっかり驚いてるとは 言えない
669,eng_Latn,English,"But ... Oh, I see what you mean."
669,jpn_Jpan,Japanese,それは、あぁなるほど
670,eng_Latn,English,I'm very proud to report that my first trick Was an exploding success. Show him.
670,jpn_Jpan,Japanese,私の最初の爆破が 成功して喜ばしい
671,eng_Latn,English,Sometimes I feel like his secretary rather than his keeper.
671,jpn_Jpan,Japanese,彼の秘書気分だ
672,eng_Latn,English,Yes.
672,jpn_Jpan,Japanese,ああ
673,eng_Latn,English,Its citizens need me.
673,jpn_Jpan,Japanese,国民が待っているわ
674,eng_Latn,English,Why did you let him in our home? He was hurt. He called for help.
674,jpn_Jpan,Japanese,怪我して助けを求めてた。
675,eng_Latn,English,I've never heard anything more dreadful.
675,jpn_Jpan,Japanese,こんな恐ろしいことは聞いたことがない。
676,eng_Latn,English,"See, to me, coffee was just a thing that my boss would drink up."
676,jpn_Jpan,Japanese,私にとってコーヒーは ボスが飲み干す ただの物にすぎない
677,eng_Latn,English,"And in so doing, you shed light on an invaluable truth."
677,jpn_Jpan,Japanese,非常に重要な真実がわかった
678,eng_Latn,English,"Frau Kelmot is passionate, but an amateur."
678,jpn_Jpan,Japanese,ケルモット夫人は熱心だが アマチュア
679,eng_Latn,English,He was carrying nothing but this.... ... and this.
679,jpn_Jpan,Japanese,所持品はこれと... これです
680,eng_Latn,English,Worldwide military is on alert. Our weapons are ineffective.
680,jpn_Jpan,Japanese,我々の武器が効かない
681,eng_Latn,English,"I've been trying to get her to marry me since, what, our second date?"
681,jpn_Jpan,Japanese,結婚するためですよ 2回目のデートだっけ？
682,eng_Latn,English,"2.3445, M_PI some trig: -1.6291725057799 a hypotenuse:"
682,jpn_Jpan,Japanese,例 3コールバック関数として匿名関数を使用
683,eng_Latn,English,I invited you out today because I wanted to get to know you better.
683,jpn_Jpan,Japanese,今日 俺が マーサを誘った理由は （政子）うん （ｱﾙﾏﾝ）いや 何か もっと知りたいなと思って
684,eng_Latn,English,I did everything you wanted. What do you want from me?
684,jpn_Jpan,Japanese,頼まれた通りやってたよ
685,eng_Latn,English,So that you arrived At the marina When tony pulled the trigger?
685,jpn_Jpan,Japanese,あなたが着くと ちょうどトニーが彼を？
686,eng_Latn,English,"And hey, there's a party tonight."
686,jpn_Jpan,Japanese,そうだ 今夜パーティーがある
687,eng_Latn,English,"The second that a bullet enters your brain, the Machine will cast you off and replace you."
687,jpn_Jpan,Japanese,2個目の弾丸があなたの脳に入った マシンはあなたを捨てあなたに取って代わった
688,eng_Latn,English,They lugged the refrigerator up the stairs.
688,jpn_Jpan,Japanese,彼らは冷蔵庫を階段の上まで運び上げた。
689,eng_Latn,English,But never further. You think this is where you die.
689,jpn_Jpan,Japanese,＜死ぬ気なんですね＞
690,eng_Latn,English,Is this to be endured? It shall not be!
690,jpn_Jpan,Japanese,とても耐えられないわ
691,eng_Latn,English,Watch out for a second Jedi loose in the station.
691,jpn_Jpan,Japanese,もう一人のジェダイがステーションにいるかも
692,eng_Latn,English,"- That's right, including his."
692,jpn_Jpan,Japanese,- あの方のも入れて
693,eng_Latn,English,"Now, was I rushing or was I dragging?"
693,jpn_Jpan,Japanese,俺の手は速いか?
694,eng_Latn,English,"- No, not the grief."
694,jpn_Jpan,Japanese,- そうじゃなくて
695,eng_Latn,English,"Hello, S.T.E.V.E., I am J-A-K, Jake."
695,jpn_Jpan,Japanese,やあ、スティーブ。 俺はJ -A
696,eng_Latn,English,Hello?
696,jpn_Jpan,Japanese,だれか？
697,eng_Latn,English,He should use an alternate route.
697,jpn_Jpan,Japanese,「別のルートを使えと いま知らせろ」
698,eng_Latn,English,Let him get away with it?
698,jpn_Jpan,Japanese,あなたは彼を止めてくれたのでしょ？
699,eng_Latn,English,"I was trying to find you, but you were gone."
699,jpn_Jpan,Japanese,捜しても見つからない
700,eng_Latn,English,MASSACRATED POLICE
700,jpn_Jpan,Japanese,"""ボストン・ポスト 警察死亡"""
701,eng_Latn,English,Maybe you got some friends in high places?
701,jpn_Jpan,Japanese,そこにツテでもあるのか？
702,eng_Latn,English,"Come on, people, let's get to it Go!"
702,jpn_Jpan,Japanese,♪ みんなで歌おうぜ
703,eng_Latn,English,I need you to translate Finch's instructions on how to destroy the virus.
703,jpn_Jpan,Japanese,あなたにフィンチの 指示を解釈して貰いたい ウイルスを死滅させる方法
704,eng_Latn,English,What about the knives? You said Travis came at you with a sword.
704,jpn_Jpan,Japanese,コロンビア組織は 大喜びか
705,eng_Latn,English,You could at least knock!
705,jpn_Jpan,Japanese,ノックぐらいしろよ.
706,eng_Latn,English,The one that was pointed at the guy's skull.
706,jpn_Jpan,Japanese,頭に銃を突き付けてた
707,eng_Latn,English,"No, g-get away from me."
707,jpn_Jpan,Japanese,だめ 私に近づかないで
708,eng_Latn,English,NORTH ELEVATORS - 10 MINS
708,jpn_Jpan,Japanese,北エレベーター−１０分
709,eng_Latn,English,"Computer, add an appropriate crew complement, objective mode."
709,jpn_Jpan,Japanese,コンピュータ、クルーを表示しろ 客観モードだ
710,eng_Latn,English,Keep them on the alert.
710,jpn_Jpan,Japanese,とにかく急がせること
711,eng_Latn,English,Oxygen! - Yes!
711,jpn_Jpan,Japanese,酸素 頼む ― はい
712,eng_Latn,English,One appeared in a Queen's newspaper regarding the complaint of an Ethan Varner against a tanning salon whose beds could not accommodate his prodigious girth.
712,jpn_Jpan,Japanese,１人は　クィーンズ新聞に載ってる ベッドに巨大な胴回りがおさまらないと 日焼けサロンに苦情を言った
713,eng_Latn,English,"No one could prove anything of course, but we already knew."
713,jpn_Jpan,Japanese,誰も証明できないが 我々には分かっていた
714,eng_Latn,English,"If I die, you lack the knowledge to send that creature back to Hell."
714,jpn_Jpan,Japanese,俺が死ねば お前は、地獄へ化け物を送る 知識が欠如している
715,eng_Latn,English,like extras.
715,jpn_Jpan,Japanese,特別な人だ
716,eng_Latn,English,"Another round, birthday boy. ...or anything that might be out there listening."
716,jpn_Jpan,Japanese,新しい一年に
717,eng_Latn,English,The line's operational.
717,jpn_Jpan,Japanese,すでに線路は開通している
718,eng_Latn,English,"Everywhere, legions of the enemy advance."
718,jpn_Jpan,Japanese,あらゆる方角から 敵が押し寄せているそうです 時間との闘いだな
719,eng_Latn,English,No crew in Starfleet has been tested more in battle.
719,jpn_Jpan,Japanese,艦隊のクルーは戦闘で テストされることはなくなる
720,eng_Latn,English,What else in that lab might be of interest to me?
720,jpn_Jpan,Japanese,ラボに私の興味を引くものは？
721,eng_Latn,English,The destroyer of all worlds.
721,jpn_Jpan,Japanese,世界の破滅だ
722,eng_Latn,English,"Beta, get a doctor! No."
722,jpn_Jpan,Japanese,医者だ
